{
  "flags": 0,
  "magFilter": 0,
  "minFilter": 0,
  "mipmapMode": 0,
  "addressModeU": 0,
  "addressModeV": 0,
  "addressModeW": 0,
  "mipLodBias": 0.0,
  "anisotropyEnable": true,
  "maxAnisotropy": 1.0,
  "compareEnable": false,
  "compareOp": 0,
  "minLod": 0.0,
  "maxLod": 0.0,
  "borderColor": 1,
  "unnormalizedCoordinates": false
}
